id,title,url,upload_date,source_primary,source_tabs,live_status,was_live,is_live,availability,members_only
-pA0ZPU1bkM,温家宝和李鹏家族围绕保险公司的内斗，胡锦涛和黄菊家族的角力，李泽源和关国亮买下深航后翻车的经过。中间讲述了张德江｜江泽民｜徐才厚｜宋祖英｜胡锦涛｜温家宝｜李鹏｜,https://www.youtube.com/watch?v=-pA0ZPU1bkM,2025-04-16,videos,videos,not_live,False,False,subscriber_only,True
wW2dytzb5e4,张德江的升迁，宋祖英的真实背景，一个连饭钱都拿不起的假释犯人，依靠张德江和宋祖英的关系，空手套白狼，买下数十亿净资产的深航的故事。中间讲述了以及温家宝和李鹏家族的内斗，胡锦涛和黄菊家族的角力。,https://www.youtube.com/watch?v=wW2dytzb5e4,2025-03-10,videos,videos,not_live,False,False,subscriber_only,True
3CLVR92dIYg,曾庆红的白手套如何帮助许家印购买恒大银行，如何侵吞薄熙来白手套徐明的资产，如何陷害胡锦涛家族的白手套 #栗战书 ｜曾庆红 ｜胡锦涛 ｜薄熙来｜关国亮｜唐一军,https://www.youtube.com/watch?v=3CLVR92dIYg,2025-01-21,videos,videos,not_live,False,False,subscriber_only,True
V6arqLM-9UQ,全网第一次系统性的解密栗战书如何清洗中办的令计划势力？他如何帮助习近平定于一尊？他如何能和习近平成为铁哥们？他的女婿为何能31岁做到证券公司董事长?栗战书｜习近平｜官场,https://www.youtube.com/watch?v=V6arqLM-9UQ,2025-01-14,videos,videos,not_live,False,False,public,False
CO6J1ieQhlA,曾庆红的白手套：戴永革如何帮助栗战书成为中办主任？如何白手起家搞起地下万达？如何取代赵本山成为支配东北黑白两道的教父？如何吞并薄熙来家白手套徐明的资产？如何控制公安部副部长孙力军？,https://www.youtube.com/watch?v=CO6J1ieQhlA,2025-01-14,videos,videos,not_live,False,False,subscriber_only,True
t1z7O7wd2bk,起底栗战书：从县委书记到中办主任的崛起之谜,https://www.youtube.com/watch?v=t1z7O7wd2bk,2024-12-31,videos,videos,not_live,False,False,public,False
