start	end	text
0	1280	开始直播
3580	7680	大家好开始直播了 准时开始啊
8200	9980	网终堵错了啊
10240	11780	一分钟都没差
12040	12800	一分钟都没差
13320	14600	我说6点半开始
16380	17920	这个表快了啊
18180	21000	现在是6点31 刚才我敲钟的时候
21260	24320	我敲那个 敲这个罗子 这个送播的时候啊
24840	26620	是6点30
26620	30200	嗨 大家好
30720	34300	王叔一回来温哥华没下过雨 虽然雾大点
34820	36860	但是晴天的温哥华真好啊
37380	40960	是没办法 该瑞理啊 这个
41220	45060	但是雾太大了 雾太大了 见不着什么大胎啊
45300	46580	哪比那边还行
47100	51700	列治文这边都不行啊 所以得上去 得上山上去
52740	55540	准时的一次给王哥牛逼坏了
56260	57020	对对
57280	60620	大家好 今天是星期四百刀会的日子
61120	67260	哎 来了 来了 终于回来了 我刚才一直在等这个信号回返
68040	72140	今天呢 主要是送送圣啊 咱们百刀会是送圣的
72640	78020	那些切片呢 别他们给脸不要脸啊 切片 只要切百刀会的 我全都给你封了
78520	81600	还给我写信说能不能撤回 不可能想都不能想
81860	83140	你凭什么
83360	86920	你凭什么让我撤回啊 我都说三零五只了
87180	91140	百刀会不可以切 还他们切 不可能撤回 重新几号吧啊
91400	93840	愿意干 你干 不愿意干 滚
94100	97420	这个撤什么号 没有规矩
97940	101260	不成方圆 有了规矩不遵守规矩 等于没有规矩
101520	102560	哇 真真
103060	107160	那个华学厂那灯真漂亮啊 你们看不见啊
108180	111520	好了啊 百刀会经常提前啊
112200	116520	这个全世界的表都快了三分钟啊 是吗
118240	121120	是吗 这不可能啊
125360	126960	真的是这表真快啊
127400	130920	那个你们接受的信号是有延迟的
131600	133360	你们接受的信号有延迟的
133960	138160	我的信号我的表数跟这个表数是不一样的 你看
138840	139920	这个是正常的表数
142040	146040	这个 哎 哎 我一看就亮了
147560	149040	华为这么高级啊 好了
150160	153040	该去找游泳服里发了 王叔
153880	156720	再等等吧 因为在夏威夷被那个孙子
157240	160600	把我这个头顶头发剪太短了
160600	164600	所以游泳服现在也改不回来啊 我得再等两星期
165720	170080	好了 我们今天啊 聊聊啊 主要几个时政啊
170080	172840	然后再给大家念一个那个古文啊
172840	178360	带着大家学一学中国古人的艺术和中国古人对于世界的暗示
179640	181960	就是侨娜啊 娇娜
183320	187840	首先呢 说一事儿 我看五月散人啊 让我大跌眼镜
187840	189680	五月散人居然说是真的 什么呢
190120	195400	这两天又他们不知道从哪个孙子那儿传出来一封所谓的宋平
195880	199360	写给习近平的信 宋平今年都109岁了吧
199600	206240	宋平给习近平写了封信啊 一开头说错了 我今年108岁了
207680	210680	宋平都不知道今年多大了吗 你自己今年几岁也不知道嘛
211360	217040	所以这个我认为啊 这个信是假的 为什么呢 宋平的信是扯淡啊
217480	224880	为什么 我告诉大家如何见别听床师在造谣啊 因为我也曾经课串过一段听床师嘛
225120	231240	你怎么听他们是造谣的 非常大老王韩宁亮 这无聊
232120	236840	老说这句话有啥意思啊 你换个说法啊 老说什么高雅松 嫖娼 冒充我
237640	243120	宋平那个信一看就是假的 就是真的这个药都看不出来的话 那真的是
244800	248560	水平怎么讲啊 事无英雄 而是床子成名也
249160	253960	为什么呢 就是这世界上有两种造谣的 一种是啊 任人真真的想造真谣
254760	256960	这是坏逼啊 然后这就是
257720	263440	真的是就认真真在那造谣 但是由于水平所限呢 就被人能看穿
264080	271160	还有一种了 就像我这样的 有偶尔我也造点谣 我就是我就是揣着明白装胡说 我不是认真真的造谣的
271720	279320	为什么呢 就是我有我的意 我有我的那个意图啊 但我不是说弄那几个油管钱 那肯定不是我的意图
280320	286880	好了 这是一种认知战啊 他在认知战 那就你要是我我刚才所有的说的这些话
287440	295240	都不成立于认知战啊 因为认知战是一个很就是一个很常见的一个打法啊 就共产党就是认知战大师
295920	304000	当年认知战牛逼到什么程度 就是认知战牛逼到让国民党千疮百孔 让副作义的闺女都变成叛徒
304840	305920	把他把他爹
306880	308880	就是给判了 把他爹的那个
310000	313440	办公桌的那个机密文件偷出来给共产党
314360	318520	要他的命 要他爹的命呢 都他爹是北京城坊司令
319160	323520	然后脚踪司令 他他把他爹的军事文件给共产党那边拿走
324560	327880	这就是认知战 北京大学女学生沈崇
328720	331000	就非得说 美国大兵强奸自己
331920	332800	红口白牙子
333760	338640	真没强奸他 他他妈咪的一口一口他们的污水
339640	341680	扑到人家北京美国大兵上
342760	349360	全国舆论华然蒋介石低头只好让美军美军二战之中
349360	353680	大家知道美军是有驻华部队的 就是有很多美军驻在中国
354080	356120	重庆那边好多军事基地呀 各种地方
356880	361400	哎 那如果美军没撤 一直驻房 像在韩国日本一样
361400	363800	我跟你们讲 共产党一点机会都没有
364440	369320	哎 就是沈崇就说 强奸我了 你看 那个美国人是不是人上人哪
369720	372960	美国人是不是不把中国人当人啊 中国的女人就这样被强奸了
372960	375680	你们还是爷们儿吗 我说中国这帮爷们儿就这么中计了
376040	379240	这就叫认知战 所以认知战不在我今天的
379720	384000	表述中啊 做认知战的就是敌我双方啊 所以这个就
384400	390360	那当然是无所不用其极 那就那不是造谣啊 那不是造谣的那些认真真造谣
390360	395640	那有啥逼啊 唯恐天下不乱的啥逼那不是啊 认知战它是有它有理念
395640	400360	有组织 你也不能说他对或者他错 因为他们都是各位旗主
401480	402760	两国交兵各位旗主
403480	410120	呃 我承认我属于业余认知战 因为我也没有主啊 但是呢
410680	415240	我就属于认知战外围的那个教长一方 那怎么去看一个
416200	420280	呃 一个属于认知战的还是属于他妈的傻逼谣言呢
420680	426120	就是宋平这封信属于傻逼谣言 他跟认知战一点关系都没有
426680	432440	宋平那封信真是假 对于中国的形势 对于中国的历史没有任何影响
433400	437800	所以呢 那封信纯属傻逼坏坏逼写的啊 但是呢 坏逼他
438280	442600	这种坏逼 就是没有认知战这个高度的坏逼一定都是体制外的
443560	447080	都是体制外的 就是他妈的野生反贼
448840	452440	呃 野生反贼这些东西 我就我告诉你嘛 就是
453640	456040	犯的一个错误 我我认真正还念了一遍
456520	461880	然后最后最后一句话就是我直接喷了啊 就是我这一句话就给我笑喷了
461960	464920	我当时嘴里边含着一口咖啡 我直接喷平了
465480	469960	最后一句话我给你念念 我年事已高 说这些话没有别的企图
470680	473880	只希望党的事业长至久安 后继有人
474520	479240	望您三思 辞至敬礼 中共老党员宋平
479560	482440	二零二六年一月三日 我就喷了
483880	484360	为什么
485080	488520	但凡在体制内做过一天的人都知道
489000	493560	中国共产党的党员是从来不会说自己是中共的
495080	497800	都是敌对势力 野生反贼
499080	502120	那个中共是他们骂共产党 叫中共中共的
503080	505720	那么中国共产党怎么会骂自己呢
506280	510120	中国共产党如果署名 要么就是一个老党员
511080	516040	要么就是中国共产党党员 要么就是中国共产党老党员
516840	520680	绝不会说中共老党员 就这一句话就行了
522760	529160	啊 摩尔 好 摩尔把这个月的提诚给我发过来了
530360	534120	很自觉 我不想他们催你们 你们这些做我切片的
534360	538280	那那些小王八蛋嘛 这个真的是有点过分了
538440	541720	所以呢 我象征性 你们哥哥哥 你们韭菜
541720	544760	你们倒点自己发过来 别还让我催你们啊
545880	549880	所以呢 哎呀 中共老党员宋平就这一句话
549880	552680	就这一个落款就完毒子 话说天足
553080	555880	为啥 这个傻逼写这封假信的时候 很认真啊
557000	560360	洋洋万言 写的真是很认真 我估计到最后就突露了
560680	563320	最后的一下 就是没忍住我就突了
563320	567480	中共老党员习惯了野生反贼 在国外 你看他们在油管上
568200	572440	他们说共产党一定会说中共 一定不会说党或者中国共产党
573480	575960	你像体制内的 大家都知道
575960	579640	就我们在体制内的时候都讲中国共产党或者党
580360	585880	其实呢 怎么或者我党有有的时候也有些不要逼脸的说我党
586280	588200	就是好像自己多顶不逼啊 我党
589320	593000	大部分都是党或者中国共产党
593720	596600	这这这这这傻逼啊 就是就第一性原理
597320	599640	就是这一句话就可以概观定论了
600200	605240	你就别听五月散人那那那从前到后讲 说如何如何象征的
605800	608040	没有意义 这就叫第一性原理
608600	609400	就是为什么就是
610440	611960	就是他不懂就在于此 为什么
612520	613480	就我就告诉你
614280	617960	一个狐狸无论装小小姑娘装的多像
618920	620920	他只要露出了狐狸的尾巴
621480	624760	他裙子后面堆这个尾巴 他就是个狐狸精
625320	627960	你就不要再铲树 我觉得他是个人
628680	632440	为什么 因为他的尾巴长出来了 怎么你这就第一性
633080	637160	无论你就不要再去描述 你看他的脸啊 你看他的肌肤
637640	640280	你看他的手 你看他说话的样子 你看他的衣服
641240	644360	你看他的脚和鞋子 他怎么看怎么就是个女人吧
645880	647800	第一性就是他露出来尾巴了
648760	650600	他后边长了个尾巴 那是狐狸尾巴
651080	653160	就够了 就这一条就够了 就是假的了
653640	656760	你就不要说他有多少地方象征的 这就叫第一性远离
657320	661160	所以这种傻逼性啊 就是我这么浪费大家时间
661960	663000	但是呢 我告诉大家
664680	665960	富东局不叫富东
667000	668520	那个我就告诉大家
669480	673080	怎么去见别这种傻逼啊 因为这个在国内在这个
673960	674600	体制内的
676040	677160	我们的观众肯定能够
677800	679640	就是知道啊 老王说的是
680600	682200	包括当年老郭
682440	685800	弄的那个所谓的那两个国务院文件啊
686040	688600	他在那个哈德逊研究所紧急烧掉的
688600	691160	号称了有多大机密的国务院文件
692440	694520	国办文件 我一看就是假的
694520	698840	因为我在国务院干过 我他们正耳巴颈的国家TI委
698840	701640	国务院经济学改革办公室 我他们上过班
702200	703400	我会写文件
705240	707800	中央文件我年轻的时候 我是会造出来
707800	711640	我伪造的文件一般人看不出来 如果我想伪造的话
712280	715240	因为什么呢 因为国务院的文件 国办 中办的文件
715720	717800	它是有公文格式的
718280	721640	你怎么用词怎么造句 怎么写抬头
722440	726040	包括抬头下面的两根线 包括怎么写文号
726440	730440	文号用中扩弧 用小扩弧 用送铁 老送铁 仿送铁
730760	731880	还是用凯体
732920	733880	加粗不加粗
734520	737480	分号还是句号是有严格的公文
738040	742280	规矩的 老郭显然不懂嘛 老郭拿出来的东西一看就是假的
742760	746600	就是我不用看内容 我就看他的字号我就知道是假的
747480	752120	字号和那个编辑 所以当时我的老老教友那时候我没开频道
752600	755960	老老教友一定知道 我当时在推特有 我说要嘛
756760	759000	是国务院在我离开这十几年啊
759480	764040	大幅度后退了 就是大幅度了草了 变成草台班子了
764360	766040	要么就是假的 只有这两可能
766760	770440	那你说国务院 国务院怎么会变成草台班子呢
770680	774200	国务院随时改革开放 随时发展中国GDP的发展
774200	779000	国务院的这些繁文乳节只能是越来越细 越来越严
779400	781480	不可能是变成草台班子啊
782120	785560	所以以前我那个时代可能还有点草台班子 这现在是不会的
786200	788440	哎呀 那个文件能计划这么写啊
789640	795160	好了啊 卢博士说的很多内容不得不信 太细节逻辑上找不到问题
795640	801800	是 老卢他得好好感谢我 我虽然贬低了他几句 但是我早我给他带了多少货呀
802440	807640	我带货呢 真是一带一个货啊 老卢现在估计乐死了啊 他不骂我
807880	813160	他心里边可感 可感恩我了 感动我 因为什么 这都是聪明人
813800	818600	老卢 我不知道他的背景 但是我知道他是做金融行业的
819000	823320	我不知道他的真实背景 就是他爸是谁 他妈是谁 我不知道啊 我不知道
823640	831320	但是呢 这个哥们绝逼是正宗的啊 就是我说的绝逼是耿红苗正的 他绝不是个野生的
832040	834040	你懂吗 他是在体制内干的
834840	843880	老卢 所以他说话 他躲起来他不露脸 他也没有用啊 一听就知道你这你是从哪来的
844440	848520	所以老卢呢 他肯定不是认真做坏事的坏逼 这肯定不是啊
849400	854280	不是摇滚 这能听出来 那他属不属于认之战 我就不敢讲了啊
854920	859640	但是呢 如果你想听政治经济小道消息 正常圈小道消息
860040	865560	那我认为他确实是靠谱 他应该目前排第一吧 那靠谱都排第一
866520	873160	所以呢 这个老王白银上周四到现在赚很多了 是不是继续持有我买的国头白银
873480	879320	哎呀 就不要问我这些问题了 你们这帮傻逼都没有财库的人都说
880120	887080	这点钱你赚多少你赚很多了 你是不是最多赚15% 20% 最多吧 25%
888200	891640	你翻翻了吗 没有翻翻你就要很多
892920	896360	你知道我老婆炒莓果翻了几番吗 你知道吗
897320	899960	6翻 6倍
900600	905800	所以我为什么对我们家 我怕老婆为什么 就是我服的无体投地
907000	910680	你们要知道什么叫财库啊 重新referenced呀 你们的定义
911240	917320	哎呀 整天问我 他们说了黄金说了得有一年多吧 黄金我大概说黄金说了有
919240	921320	去年是2024年
922040	929240	2023年11月到现在2023年2024年 我说了两年了黄金 两年黄金
930760	936840	不停的有人问 老王啊 黄金又跌了 老王黄金跌了 你怎么 你的脸呢 老王黄金跌了
937320	944680	你们害我们吗 你这个傻逼我操 真不蠢啊 这蠢傻逼 从那么2000到3000 4000
945320	949960	现在奔5000去了 黄金是没人问了现在 因为脸给他们打肿了
950680	955960	白银又开始问了 你就觉得这种事没办法了 我呢 哪里没办法啊
959080	963000	感谢老王为什么要删掉呢 啊 为什么
964840	970840	为什么老子维 为什么不让老子维发消息呢
972120	977640	老王 我白银从上周四赚到很多了 对呀 这有病啊
978600	980600	物操作 什么地方物操作呀
984360	988920	不给你管理员了 操个蛋让你 给你点权利 你乱飘啊
989560	992920	你就别在他们的百道会给我删别人的评论啊
993560	998440	你在公评论删我都不说啥了啊 百道会肯定不行啊 真的不行
1000600	1007240	而且人家没说啥呀 妈 我的你可以删呀 我假装看不见就得了 你们人家是说好话你给人删什么
1007720	1010600	物操作 谁信物操作呀 这个
1013080	1019320	能连续三次物操作吗 你信吗 他为什么要连续三次 他杀人家三条
1019880	1023080	物操作啊 行了 他就不用操作了啊
1024680	1027560	都百道会了还问这种问题 而且百道会的
1027960	1031160	百道会他有可能是憋了好久 然后来来这么一次的啊
1032120	1034840	大家大家互相理解啊 真的是
1035560	1038760	就是不是说每个人都能一个月拿一百
1039480	1046520	当然也有可能是从那个国内带冲从阿根廷过来的 那也有可能啊 但是无所谓啊 反正咱们也真别不出来现在
1048440	1052440	给我管理员怎么说要报仇是吧算算算啊
1053160	1059080	我去年买的白银现在赚80%可以买少了 这无所谓啊 真是没有
1059880	1061160	那我给我给大家先
1061800	1063800	抛转隐喻啊 一会儿
1065400	1070360	不是叫主人家给取消了 什么取消了啊 记住你跟他在一会儿了是吧
1072360	1078040	回车就买入对可以 他会回条的 任何东西都不会是一番风顺的
1078600	1084040	任何的牛市或者熊市 你像中国的房地产现在就在典型的熊市过程中
1084440	1090680	但是你记住我这话 即使在中国的房地产他也会有他也会有回条的时候 还要回条赶走啊
1092120	1099480	啊 好嘞 我也摆到会快一年了 比格先生啊 比格先生一年了咋了 嗯 这儿有好多一年的啊
1102120	1104280	嗯 摆到会也是凡人 就是啊 嗯
1106360	1111400	嗯 把今后把财神放一边 把娟儿姐摆中调
1112360	1117080	这这这 我们家老婆她的财库好 我刚来的时候 我
1117640	1121240	我就很后悔 我就把我所有的开始给她了一半给我了一半
1121800	1128680	然后我这一半吧 越花越少 然后人家那一半就翻了六倍 我现在人家变成我的老板了啊
1129400	1139000	白银回条可以入手好了 股票我最近不敢推荐 因为每股涨的太高了啊 当然要是有特斯拉呢 肯定还是特斯拉呀
1139960	1146280	嗯 啊 行 臭 黑臭又谢谢你啊 祝你发大财 我们接着说正经话啊
1147160	1150040	来自卡尔加里的这么一封信 这是个基督徒写的信
1150600	1155000	我呢 把他放到摆到会跟大家交流 他也是摆到会的 应该是啊
1155720	1161240	老王兄弟你好 我叫斯蒂文啊 这是我第一次给你写信 其实我一直都想跟你交流
1161640	1168600	这段时间我一直在忙于英语和工作签证的事啊 卡尔加里就是二伯塔 就是现在闹独立的那个声
1169160	1172920	要加入美国的那个声啊 就是卡尔加里的老百姓啊
1173640	1179400	是都愿意加入美国的 美国不是要让加拿大成为第51周吗 卡尔加里会首先干这件事
1179800	1188600	因为他们正在征集公投签名啊 公投签名只要178000 我说你把逼过了啊 搞不好他们的现在已经有50万了啊 公投
1189640	1196200	签名三三50万了有可能 那二伯塔只要公投呢 也基本上大概率会通过
1196760	1202360	那也就是说二伯塔独立出加拿大只是时间问题啊 看我的嘴型
1202840	1204920	只是时间问题 说老王那为什么
1205480	1210280	魁北克这么多年 公投都通不过啊 你多新鲜啊 你以为魁北克人是傻逼吗
1211080	1215400	魁北克是个纯穷逼省 你可以理解魁北克就是
1216440	1220120	就是西藏或者魁北克就是青海
1221080	1228120	纯逼穷省啊 这一点GDP都没有 魁北克呢 全靠中央转移支付
1229400	1232600	阿尔伯塔是什么 阿尔伯塔是广东或者上海
1233560	1237800	阿尔伯塔是广东加上海 就是中国中华人民共和国
1238600	1239480	各个省里边
1240280	1245240	这两个省上海加广东省的GDP和财政收入永远是挣钱的
1245800	1246760	或者是第一位的
1247480	1255240	要么第二位的 这两个省上海市和广东省合起来就是阿尔伯塔在加拿大的位置
1256200	1259000	阿尔伯塔每年的财政营与几百亿美元
1260760	1265080	数百亿美元 我忘了是两百还是四百 反正就是很多很多的美元
1266360	1268680	几乎我们加拿大十四个省里边
1269160	1273400	十四个行政里 阿尔伯塔是一纪绝尘非子校无人知识立志来
1273800	1275080	就是挣这么多钱
1276040	1278600	第二是什么 第二是我们温哥华这个省
1279160	1284840	我们温哥华这个省一年的节鱼六十多亿 好像是家园 单位美元家有望
1285240	1290600	反正六十多亿就算第二了 你就能想想别的省有多惨
1292200	1296600	奎北克是付四百亿 奎北克就是别人都挣了钱
1297080	1299480	都给他 完了还得再贷款给他养着他
1299480	1302520	所以奎北克是绝逼不敢独立的
1303240	1306840	奎北克这帮村子很独立 就是要钱
1307480	1311240	我要独立 然后又赶紧特鲁多赶紧给钱 然后不说了
1311960	1316200	他就这么玩了 所以你要是奎伯塔你想不想独立
1316840	1318680	之所以你之前一直在忍
1319400	1323640	就是政治经济环境不允许你干这个 你干这个美国人也不会接招
1324120	1326920	你独立说加上美国交拜登不会
1328840	1329720	别往我身上贴
1330680	1335080	现在川普说这个事 奎伯塔后顾无忧了 美国肯定接着他
1335080	1339880	所以他这事就是一定会发生的 咱们本频道主打一个真实
1339880	1342920	而且我告诉你们 这会发生就是因为这是数据说话
1343320	1347000	这是钱在说话 这不是说一个漂亮的演讲
1347480	1351320	他们的一个摇滚青年的一首漂亮的歌曲
1351320	1353960	然后就能改变的 改变不了 这是实地决定了
1354600	1360600	大冰桂锅 快点给我们发点张教授照片 我们好
1361560	1366440	工程财神 别弄了 他不愿意干这个事
1369960	1371560	教授夫人能长你这样的老公
1374360	1374680	好
1379640	1382360	好吧 还有人给他说话 说好话
1382680	1384920	行 那一会我再把那个小班手还他吧
1385800	1388040	那个先让这安静安静
1388680	1390600	加拿大也有转移支付吗 一样的
1391400	1395800	一样的 还有 大省 有钱的省 尤其是二伯大省
1396440	1399000	每年给中央 给联邦好多钱
1399240	1405160	然后联邦和中央就把这个钱再转到这个魁北客
1405560	1410040	扶植魁北客 这就没办法 维持一个所谓的大家庭
1411000	1414040	那么我接着说 这段时间 这个是二伯塔
1414280	1418040	二伯塔就石油嘛 所有石油都运到Kansas
1418360	1421160	运好久 运到那个美国去练油
1421560	1424600	这Kansas那边的练厂 为什么运这么远呀
1424920	1427640	多新鲜呀 因为BC不让他修油管
1427960	1430920	所以AAB的石油无法运到中国
1431160	1433320	因为去中国得从文革华上传
1433640	1436520	也无法卖给欧洲德国 天然气 为什么
1436520	1439720	因为安省和那个五大湖区的那些省
1440520	1443720	也不让阿尔伯塔省把油管修过去
1444120	1446120	为什么 不为什么
1447800	1452840	有鸟 花花草草 你修个书油管 不就破坏环境了吗
1453560	1457400	那破环境了 大家吃屎啊 大家那吃土吗
1457560	1461160	对 吃土可以 花花草草不行
1461400	1464600	他们当时 保守党在的时候 为了修书油管啊
1465640	1469880	来应的了 就是那个石油公司 恒山石油管道公司的工程师们
1469960	1474440	直接开山批地要修石油管和天然气管
1474680	1478360	这不是大好事吗 我告诉你嘛 我一点不夸张
1478360	1480200	我他们亲眼所见 当时我都傻逼了
1480440	1484120	那个时候我不了解希望 我刚刚移民过来 我的三官还未成熟
1484920	1488040	然后我买了一大堆恒山石油管道的那个股票
1488440	1490120	因为它那个分红分的特别好
1490920	1492440	我草又开始给你们推荐股票了
1492680	1496760	就是加拿大有一个叫恒山石油 恒山之谋那两个字
1496760	1501640	恒山石油管道 就跟发退休金一样给你分红
1502600	1506680	然后呢 我们BC的这帮左B啊
1507640	1511400	都是白的 都是白人啊 都是那个女的多 男的少
1511960	1515800	他们就爬到那个路上 避坎的那个大树上住上去
1516360	1518520	一住住好几十天啊 不下来
1519160	1522920	你要是坎你就要把树放倒 你把树放倒 他们就会被砸死
1523400	1528280	是被摔死 你砍吧 于是于大树共存亡 你就干不下去呀
1528680	1531080	警察也没办法 他有爬树的自由
1531560	1535160	关键是左B政府 警察也不想管 做警察在那看热闹
1535960	1539960	所以就没法修啊 这就是这就是为什么加拿大经济不繁荣
1539960	1543160	你们就知道我为什么那么反 反对自由党继续执政了
1543160	1544600	他就不干人事啊
1545160	1547960	就是保护动物啊 世界第一 保护动物
1548920	1555480	保护臭养层 防止地球变暖 这就是加拿大政府主要工作目标
1555480	1559720	就是阻止臭养层 阻止地球变暖 你
1561480	1568840	急趴匹夫汉数 不自量力 地球要变暖 是你狗急趴特鲁多能阻止的 阻止得了的吗
1570040	1575160	好了啊 参与了四年Transmountain的建设
1576120	1579400	那Gary Lee就干这个事了
1583080	1586680	王总之前很多直播里讲了一些对英文单词的理解
1586680	1589400	虽然不是专门的英文频道 但讲得特别好
1590040	1593320	那我这个就是就是我亲身经历的嘛
1593320	1597480	所以 阿尔博塔是出了钱还对 还被遭辟眼
1597480	1602520	就是你他妈要是阿尔博塔的老百姓 你得气死 就是钱你出
1603240	1605240	因为你最有钱 没办法
1606760	1609480	PR你也出 我们活好大
1610760	1613080	过来 这就阿尔博塔
1613080	1615880	阿尔博塔在加拿大的地位 就是这样了
1615880	1619240	所以阿尔博塔人人想独立 人人亲美
1619240	1621880	你别信卡尼在那儿胡说八道的
1622520	1625240	卡尼在那儿胡说八道的 在那儿跳起来叫好呢
