start	end	text
3203720	3205240	川普太羡慕今上了
3205960	3213880	秦皇汉武的历史评价一天不被清算 中国一天就没有希望 你说的太好了
3214280	3216840	这就是我们频道 我们频道挖完了民国
3218600	3223720	我们就去挖秦日皇汉武帝的坟绝 必须把他们的真相打出来
3225800	3228280	你脚面凶农有功 有功不假
3229480	3231240	但是你同时干了些什么事
3232200	3235640	你统一中国不假 但是你统一中国的代价是什么
3236200	3239560	中国被你统一了之后是好了还是不好了
3240680	3245320	如果你没有统一中国 中国一直没有完成一个真正的大一统 一直像西欧一样
3245720	3247880	像欧洲一样发展到今天 是不是比今天好
3249880	3251560	这就是第一性原理
3252200	3256520	你狗糟的给统一了中国以后 中国人都变成奴隶了 都变成他妈的猪狗了
3257480	3259720	你还吹什么牛逼统一 你就不应该统一
3261640	3268120	所以特意用电脑直播把我新生说出来了 做人与治国一样 没错
3269960	3275400	昨天我们参加一个中美青年的对账直播 看看老A说的对不对 发现老A一派悔哀一下
3276120	3279960	老A就是一个在在美国西雅图的大专生
3280440	3286520	他那个基巴学校叫什么清苹果学院什么基巴清草学院 就是那个基巴的就是北京
3287240	3294200	人福科技大学 就是那么一个一个一个基巴学校 明白吧 就是西雅图那么一个基巴学校 他都30了今年
3295320	3296680	他他留不下来
3297480	3300120	那个IC一满街抓人抓的就是他这种人
3301240	3304600	他的英语到今天都没过关 我不过关是因为我什么
3305000	3309160	上这儿 我不用上班 他要工作学习 他英语那套影 他不过关
3309480	3315160	他是用机器翻译的 AI翻译的 然后在那个Reddit Reddit他可以唱所语言 Reddit有点
3316120	3319080	Reddit他有点像当年的水木清华bbs
3319800	3323720	或者那个天涯bbs 他在Reddit上看这些
3324600	3332440	Reddit上就是天涯bbs 当年啊 就是中国最好的时代的天涯bbs 就有那种都市传说恐怖传说频道
3332680	3336360	里边有什么吃人的 杀人的 弄小孩的 他就喜欢看这个
3336680	3340360	看这个之后他机器翻译了以后 我操 他就在中国当真事讲
3341320	3347880	然后因为也没有爱情啊 因为他长那个操又有他们这样的一个世界观啊 又这么一个人生状态
3348200	3350920	他们没有爱情 所以他就恨这些女留学生
3352280	3355640	说说说就开始胡说八道 说什么所有的中国女留学生都是什么
3356120	3365000	都是都是卖的呀 就是这就是无名话 我一派胡言 因为我有很多朋友把孩子放到这让我看着他们做小刘
3365560	3370200	有好多是女生 都很好啊 老是八家的 都非常好的好
3370760	3378280	家也是好家人 孩子也是好孩子 你一句话就把所有的中国女女留学生都打入纪女行列了
3378680	3380200	还他们是倒贴嫖姿的
3380760	3383480	你这这个这个傻皮老爷就是
3383960	3390600	他这样的人居然在中国变成了一个什么中宣部立推 你就知道这个这个证券有那么多邪恶
3391560	3397160	说正经话的 你像高晓松啊 什么护尘风啊 不让人家说话呀
3397720	3399880	高晓松能不了解吗 高晓松一直在美国
3400920	3405480	不让他说话 所以这个这个事是没有意思啊 没有意思
3405480	3409720	所以听到一个坏消息 就是张永霞 刘正丽被抓
3410280	3416200	被抓 如果你是我这样的世界观 你一定不不喜欢看这个消息
3416520	3418760	如果你们的世界观能理解刚才我说的
3419080	3424680	因为我已经看到了 如果他不被政变 中国会往什么方向发展
3425960	3428680	春夏秋冬的都没到呢 我在告诉你们
3429400	3433560	听明白吗 春是邓小平 夏是江泽民
3434920	3439720	邓小平在在深圳坏了个圈 万物复苏那是春地
3441000	3443640	夏地是江泽民啊 水公地啊 上海人啊
3443800	3448840	上海人啊 百物繁荣 但是哎呀 但是非常的腐败
3449880	3454120	夏天嘛 你想想夏天臭不臭 文营多不多 文营自胜
3454120	3459880	但是夏天的人啊绝对好过 你饿不死啊 夏天的中国人是最舒服的
3460600	3466600	夏秋 这是秋 老习是秋地 冬天还没到呢 所以
3467560	3474840	冬天就是我刚才说的那个那个场景 阴阴暗暗 暗暗阴埋杀不用刀 就是那个场景
3476680	3483080	暗暗阴埋杀不用刀 一人不死万人难逃 就是那个场景 他说的就是那个状态
3483800	3489240	人都就像送外卖的小哥 你们想一想 他现在的状态比他们再惨上一倍
3489560	3493160	而且心里边的那个力气和火都没了 为什么 有AI来了
3494120	3498120	就是你现在还可以开个车去撞人 我他们跟他们拼了
3498600	3503000	我要把所有的人都带走 你还可以干这事 你还可以把什么东西给炸了
3503640	3505640	有了AI之后 你想都不敢想
3506440	3509800	有了机器人 你想都不敢想 机器人听了你呢
3510520	3516280	你想干这个 我操 你想开车撞人 车自动把你给锁死 报警
3517400	3519080	这就是AI十年以后就是这样
3519800	3526760	你只能老老实实地当行走的人们的肉变气女的男的就是器官培养敏
3527080	3533960	所以不好 这样的未来根本不好 根本不是你们小粉红想象的什么 鸡巴黄汉想象
3534360	3538680	大汉回归狗鸡巴 你根本就不知道大汉是啥意思
3539240	3543800	你根本就鸡巴不知道汉朝汉武帝那个时代有多可怕
3544040	3548280	算命令 告命令出来的时候有多么民不聊生
3548840	3553400	你看到那句话 你都不能相信那是汉朝发生的 就是一个好好的一个家
3553960	3560360	好好的 就是像老王这样一个特别大的一个王府 就是一个他们的一个大宅子
3560360	3564520	然后花隔壁邻居给你告了 没交税
3565880	3570280	然后全家下一站 新疆乌鲁门奇
3571240	3573720	去乌鲁门奇看雪去吧 全家去了
3574920	3578040	小女孩有点姿色的 全卖到关际去了
3579480	3584840	然后家里边抄摸了之后 把告你的人和汉武帝官府分了 把人家家财分了
3585560	3588120	那是汉朝 你愿意生活在这样的汉朝吗
3589720	3594840	哎呀 我操 你可千万不要以为汉朝是那么电视剧 演得那么牛逼我操
3595320	3599480	几十万汉军出征 你以为那几十万汉军从哪来的 吃的饭从哪来的
3600440	3604680	啊 古代又没有什么高速公路 又没有火车 一打打到他们内蒙古
3605240	3610680	外蒙古去 那个钱是谁出的 你知道那个马吃都比冰吃的好吗
3612120	3616760	汉武帝的站马 一天那个站马是要吃鸡蛋的
3617800	3619800	是要吃鸡蛋是要吃豆子
3620840	3624840	是要吃很好的 就是他那个战士吃不了的东西
3625800	3628280	精铭 为什么 因为他是站马
3629080	3632440	他要养标他冲锋 他不能 他不能 他不是拉大车的
3634600	3639240	那你说那些那些钱那些他的冰吃啥是吧 这冰一天就吃那么点
3639960	3641160	特别破的那些干粮
3641960	3645400	糙米饼子 你愿意去汉朝当冰去吗
3646600	3648200	那个隔壁马比你吃的好
3649480	3654520	现在能拿那牛马牛马就夸你了 让你当汉武帝的牛马 我操你配
3655480	3659320	汉武帝的牛马是要 汉武帝的马是要冲锋的 那是有鸡蛋吃的
3660520	3664840	所以这两天关心张耀侠的事是满天飞啊 那些新闻啊
3665400	3670360	为什么我超级关心张耀侠 我跟张耀侠根本不认识
3671000	3673800	我他们才不关心张耀侠呢 我关心的是
3675000	3676920	根本上来说我是关心习近平
3677960	3680520	对不对 你说我关心张耀侠不就关心习近平吗
3681160	3683800	然后关心中国的前途和中国的命运
3684600	3689480	唯一的希望 其实中国改变那个未来的那个
3690360	3694200	那个vision的唯一的希望就是效法当年四人帮
3695320	3699320	解放军直接政变 解放军军变了 就把四人帮抓起来了
3700040	3705560	耿彪 叶简英 李先念 带着他们的65军南口坦克团直接过来了
3706600	3710840	65军干政变 耿彪 杨洛耿兵团 十九兵团干的
3711560	3715720	一个军就够了 别的军根本没不知道啊 许是有根本不可能啊
3715720	3720760	许是有南京军 许是有四人帮的 陈夕莲也不可能啊 陈夕莲是沈阳的
3721320	3724440	他不知道啊 你训雷不计二到零而想定当啊
3724760	3729000	所以他已经把中南海给占了 所以他只能认了
3729480	3735880	所以只能效仿兵变 中国共产党也不是没有发生过兵变啊 就是把昏君拿下来
3736600	3738120	至少能够
3739000	3745400	虽然推不翻共产党还是共产党执政 但是至少换上来这种改革开放这些共产党人 慢慢的和平演变
3746040	3749880	慢慢的啊 一步一步的党内民主啊 他就变成一个正常国家
3750280	3757160	就像台湾一样 台湾国民党不就变了吗 国民党是下了台 但是台湾成呈现了一种民主选举
3757720	3762200	呃 人民群众得到了实实在在的好处 因为他有全民健保
3762680	3766360	你看贵州小微那个傻逼 现在老成什么草营了
3767000	3773640	在台湾的时候多生龙活虎 说明一切啊 全民健保 台湾老百姓拿的退休金
3774040	3778680	重地的那个拿的退休金 老农民拿的退休金和军工教差不多
3779480	3785080	你这就是对老百姓好吗 你中国的军工教拿多少退休金 你们这一帮重地的老百姓
3785480	3788200	都他们没都是不让你们烧 把你们冻死了都
3788920	3793320	所以这别跟着什么 人家军工教喊 人军工教拿多少退休金
3793800	3798440	你算个老几 所以你还跟人家喊 我才是 人家他们去天安门
3798840	3806520	看生气喊伟大是有道理的 因为人家在敲你的骨吸你的髓 哇 你这个鸡巴被敲骨被吸髓的也跟着喊
3807000	3814760	所以传闻呢就说什么呢 就说张伟侠刘正丽 中少军什么 同一天被抓
3814760	3821400	同一天被抓 而且张小侠的家人陕西的阵亲属都被抓光了 说什么高层都通报了
3822200	3828600	然后重要的是什么 说原副总参长叫魁夫林上将
3829320	3833560	15号1月15号去世了 所以他正在举办追悼会
3834280	3839960	追悼会上有张小侠的花圈被临时拿走了 我一听这个我的心都拔两拔两
3840520	3848200	主要这个信息来源一个是西雅图的老菜 一个是东京的老鲁 就是他俩的这个造谣的来源是他俩
3849880	3854040	但是我为什么心里拔两下没骂他俩是摇棍的 因为他俩不是属于坏逼
3854920	3862680	他俩属于认知战 刚开始开局的时候我跟大家讲要分辨坏逼和认知战 坏逼就是小人
3863000	3870520	就是不值一提 罪而小人 就是垃圾都是 但是这两个先生属于认知战 他们都是正规的
3871880	3879960	这两位先生都是前体制内的人士 在国内也都有自己的人脉 而且之前他俩的爆料还都是比较严谨的
3881960	3887560	这俩属于是严谨的时平人 那么我就一点有点懵啊 那么
3888120	3897080	所以不敢轻易的把他们推翻否决 但是这个时候 就是今天出来这么一个细节一下子就把我的这个新房击碎了
3897640	3903800	我就是真的 我现在真的不太高兴今天 为什么呢 因为有这么个细节 什么细节 叫做魁夫林
3905640	3912280	魁夫林是谁 大夫人不知道 对吧 魁夫林上将追到会 前次副总参谋长 那谁知道啊 魁夫林是谁
3912600	3919320	魁夫林是老十三军的军长 听明白了吗 就是张有侠的老军长
3920360	3925560	当时是成都军区 十三军十四军 魁夫林是老军头 张有侠是他的兵
3927640	3931640	所以魁夫林去世 张有侠一定会放花圈
3932920	3938440	那张有侠的花圈被拿走 这是一个细节 为什么 说明这个事很真实
3939160	3941400	因为他被打倒了 所以他的花圈被撤下来了
3942120	3947880	他的遗体告别是 习近平未必送 但张侠一定送 因为他们之间有有这个
3948400	3951760	刨则之遗 而且是上下级关系 老领 老首长
3953480	3958160	花圈都撤了 这是个细节上的重要的作证 如果这个细节做实了 那完了
3958880	3962720	这是个细节 因为边瞎换 他边不到这么细
3963640	3971440	正好赶上魁夫林死 你把这事拧到一起 你知道要编瞎换 这个人得多猛 这个人得多清楚
3971880	3980320	他知道魁夫林和张有侠的关系吗 而且他也得知道魁夫林在正在追悼会 正好赶上这个结果眼
3981280	3985480	那我觉得编瞎换的人没有这么强的信息解锁能力 AI也编不出来
3986120	3996600	那怎么办 那如果这个事是真的 如果是这样 到现在为止还不能确定是真的 但如果是真的 这真的概率已经很大了 越来越大了 那如果是真的话
3997600	4003880	那你想想是不是又来一波大清洗啊 前一段时间解放军那些军头战错队的 包括
4005000	4010280	党政圈那些有点摇摆的 多少人头落地呀 中国还能向
4011080	4013160	普世价值回归嘛 那不可能了
4014360	4019800	所以我要跟蔡卢变一变的就是什么呢 就是有好多人啊 就开始笑话我们
4020760	4029960	你看老王你这傻逼 你就是你就是乃死的 张有侠被你乃死的 我操我这怎么就叫被我乃死了
4030680	4035720	那因为他说你看之前啊 就是海外听众师说习下理上
4036680	4041480	子虚无忧 就把李克强给乃死了 李克强他们的游泳死了
4042040	4047880	所以呢 你看你老说张有侠军神之类的 谁别惹张有侠之类 完了 张有侠完了
4048680	4056200	被你乃死了 说什么呢 说尤其是蔡和李这两个认知战的这两个就是这两个正规军啊 就是为什么他说
4057960	4059560	他说我们这个尤其是
4060440	4066760	就是羞辱我呢 为什么呢 因为他说他们俩虽然我不知道 他俩好像不是一个派系的 但是他俩都坚持
4068200	4071160	他俩都坚持 习近平亚根没有失去过权力
4072440	4076760	对吧 你看我没说错吧 他们都坚持 习近平在清洗习近平
4077480	4083640	31军的人被拿下来 是习近平在铁罐反腐 因为他要打台湾 他必须要做到他们的
4084440	4092280	就是令形如山 如山岛 谁也不能抗拒 所以他自己把自己亲自提拔上人都抓起来
4093080	4101960	正说明 中国只有一个习近平说的算 别的就没有什么习派反习派 习就是反习派 反习派就是习 就是他们的观点嘛
4103600	4110520	那我是一直不赞成这个观点的 那因为即使是张有侠这次真的被抓起来了
4111000	4114840	真的是 我认为这属于政变过程中的大义师荆州
4115880	4119960	就像他们当年李世民 玄武门一见射死李建成 李元级一样
4121080	4132160	秦王府的军队不弱的 就是他们的电光火石 你拿着你也可以说是天命所归 你就赢不了 李建成加李元级就干不过李世民
4132800	4137960	你就是什么 玄武门大义了 你不去或者你多带点兵不就夺门 夺不了了
4138800	4149720	玄武门之变 那么关大门的那哥们 你事先把它干掉 或者把它搞定 把他家人抓起来 他就不关门 不关门你跑了 秦王府很快卷土重来
4151000	4153600	不是 那个卫王府卷土重来 肯定把秦王府给灭了
4155080	4164040	所以哪怕张有侠是真倒了 我认为他也是这么 要么是天命不归 天王我也 要么是大义师荆州 为什么 因为不可能
4164560	4170720	老习一直大权在握 不可能 这跟习下理上不一样 这个中间一定出现了
4171360	4175320	习在某种程度上被架空 失去军权的过程
4176360	4180880	然后呢 只有这两个两两条路线 一就是他们说的 任之战的
4181760	4187240	正规军们说的 习一直大权在握 是习斯大林同志在清洗斯大林同志
4188200	4196200	b 谢谢王红侠 祝你发大财啊 刚才这个是朱地利 祝你发大财
4198920	4202840	朱地利那个现实 我不知道你写的啥信 一会我看啊
4204680	4210880	那只有这两种可能啊 老习真的是一直大权在握 那我们就是全是他们的瞎子 胡说八道
4211280	4212680	b 就是老习真的被
4213440	4218680	中间给架起了 架起来之后改开派 元老啊 弄什么决策意识机构啊 又跟他们的
4219600	4223520	军方啊 又有他们的各怀鬼胎 结果他们不能一鼓作气
4224240	4230920	然后被人家扮猪吃老虎放倒 这是这两个两个可能 为什么我我坚持是第二个可能 第二个路径呢
4231520	4238240	为什么 因为他这两个路径虽然最后结局是一样的 结局就都是张亚侠被抓被清洗了
4238800	4245480	结局是一样的 但是他们路径是完全不一样的 所以你不能说结局一样的 然后就否定路径的区别
4246680	4250720	因为这这是很简单的简化思想 就是把历史简化了的思想
4251440	4253040	你这种人 你这种人
4253680	4260800	如果你是个绝壁高手也行 如果你这种人不是绝壁高手 你用这种简化思想教育老百姓的话 老百姓变成傻逼了
4261880	4266080	也许这次我们说错了 或者我们猜错了 历史往那个方向走了
4266920	4272080	但是我们知道有A B两个选项 和我们不知道是完全不一样
4273120	4277920	你知道了以后 你再看这些东西再发生的话 你马上能想到还有个plan B
4279360	4287440	这就是学历史的价值 学历史不在于预测未来 不在于预测未来 因为未来只有上帝决定
4288400	4296800	学历史不一定能预测未来 但是能在未来发生任何事情之时先于别人
4298960	4300240	看到所有的选项
4303360	4308960	这就是价值 我不是说学完历史之后 我告诉你 B言选C 不是
4309680	4312480	而是发生的事 我告诉你 有A B C D
4313440	4313920	四个选项
4314080	4325440	这是学历史的价值 你有了这种知识之后 你才不会被历史淘汰掉 你才不会变成它们的行走的肉变器和行走的器官培养民
4326640	4338160	那为什么在这一年半里面老习确确实实被架空了呢 因为人事宣传 这两个口径都出现了巨大的变化
4339120	4350960	人事不用说了 四中全会开了没几天 前三天 国防部星期五晚上突然官宣九名习派的上将 河位东苗华落马
4351920	4359760	所有的官媒记住 只发生了几个月 没有人能否认 没有人能搅浑水
4360400	4366880	星期五星期六星期日 所有的官媒包括人民日报新华社央视一个字不提
4368880	4377280	这正常吗 如果习近平一直大权在握 是习近平在清洗习近平 那有什么不能说的呢
4377760	4388960	一次揪出九个大老虎 简直是重大的成就啊 反复伪业呀 官媒要大张旗鼓的报 当年怎么抓国博雄的 怎么抓徐才厚的 怎么报的 就要怎么报啊
4389520	4393920	为什么鬼鬼祟祟的手术两端 四中全会这么重要的会议开的时候
4394560	4397840	中央电视台新华社就跟没发生任何事情一样 大家知道吧
4398400	4399520	开完了才报一下
4401600	4410800	中央电视台和那些新华社社长们要要死吗 这么大的事不报 为什么不报 官媒为什么这种态度 不敢站队呀 这他们这不是
4411440	4417840	太简单的逻辑队呀 这些铁证是下图菜 菜先生和东京鲁先生
4418280	4421560	老鲁老菜 一直不解释也不也回避的
4422520	4430160	回避 因为他解释不了 他为什么回避 他当然是揣着明白装糊涂了 他们俩都是
4430960	4435400	下图菜先生是什么的媒体出身 东京鲁先生是金融出身
4436600	4449400	他们能不懂这些东西吗 能不懂中共内部的这些宣传口的一些规矩吗 那为什么看不见呢 那没办法啊 认知战没办法 他有战略 有战术 那只不能
4449800	4455440	掌他人至亲灭自己维缝 不能让事实放出去啊 最近一年半
4458160	4462440	宣传上铁杆大批落马的时候 宣传时代风换李干杰
4463360	4473000	习仲勋纪念馆 未来那个习仲勋纪念馆改名叫观众革命纪念馆 观众革命纪念馆挂牌的时候了 习近平一个人没去
4474720	4477280	陕西省委省政府也没有大官去
4480320	4483280	废太子胡春华高调频频露面
4484560	4491640	宣传口所有的宣传口从军报到人民日报经常提集体领导 反对个人崇拜
4493880	4499480	我们一尊的办公室从营台那个大拗费死带带书件了
4500520	4502680	带红击子的搬到了
4503520	4507960	偏居一小一角中南海那个最偏僻的中南海大雨山
4508760	4511320	手水库的那个位置就风泽园的淳于寨去那
4512640	4514760	那这都看见了吧
4516440	4526000	2025年今年2026年元旦元旦至此都没有office了吧 没有后边书件 没有家人的照片了 甚至没有红击子 看见了吧
4527360	4528520	这这是谣言吗
4529440	4531760	所以你据此当然可以判断
4532520	4539920	这个历史过程AB两个路线最后虽然得到了同样的结局 就是老习把老张清洗了
4540560	4544400	但是确实是AB两个路线里面B才是真的
4545280	4549360	A就是所谓的老习一直大权在我自己清洗自己扯鸡不蛋一派胡言
4549760	4554720	而B就是老习中间真的出现问题了 半猪吃老虎赢了这次翻盘了
4555400	4562960	但是这也说明他们他微如磊卵 真是全斗高手 所以但是这样的话
4564200	4565200	即使这一年半
4566560	4567400	就是挨收视
4568640	4574000	微如磊卵重新 重新半猪吃老虎尚未成功 麻痹了敌人把敌人诛灭酒族
4574920	4579400	但是呢 你也是元气大伤啊 你身体能不能撑到21大
4579960	4588760	都是变数 但是总而言之 我们必须用事实说话 如果这个事 如果这事没发生啊 过两天人张一下 特别气着又回来
4589160	4596280	那中国改开还有希望 但是如果真的发生了 那我告诉你 从我心里来说是非常矛盾
4597920	4599240	能理解那种矛盾吗
4601520	4607560	用人框都对人框不好 以后替代你们了 反而对你们好了
4607840	4615320	昨天的美国青年说 放弃幻想吧 懂什么是官僚资本吗 资本控制是前说话 只不过是多好 少的问题
4615720	4622720	而官僚是权力控制的 是等级 以后送外卖都是无人机 还讲了一下美团无人机项目
4623160	4630960	效率比人强10倍 成本低10倍 利润百倍 早晚回到来 妈超超你说对啊 就是我跟你讲 就是那个美国青年看的是很准的
4631400	4636480	就是如果你这个国家是这样的一个体制 就是汉五地的体制 人是牛马
4637440	4642800	而牛马都比你强 牛马有用 你那么没用 那你如果是这种体制的话
4644280	4652360	你不要以为AI到了 跟你有关系 我心里很不开心啊 为什么
4653640	4656400	知我者为我心优 不知我者为我割酒
4657480	4664160	我现在一个他妈的公开频道直播 妈进了一万人 我还用割什么酒啊 我还割个屁啊
4664880	4668320	我带啥啥火 我都不敢带货 我一带货就火
4670160	4672480	我完全可以不出来自做自媒体
4673760	4677200	我不出来做自媒体 我不是过得一样复足 一样安全
4678640	4684720	我做自媒体 出来做自媒体 我可以不骂老习 我可以不送胜 不也一样 不送胜的自媒体有的事
4685600	4692800	四平八稳的不也一样吗 讲讲历史 讲讲动物 讲讲外星人 讲讲扯鸡不蛋的事 讲讲东莞
4693200	4700320	不也一样 回国的时候去一样安全 我在国内到现在有公司 我在国内是有业务的 有生意的
4701360	4704640	我只要不出来做自媒体 或者不出来送胜的话
4706080	4711120	我这些业务都可以光明正大的运作 不骂老习的自媒体有的是在西方
4713360	4718800	所以我其实非常的矛盾的这么一个行为 因为我知道如果他不下台
4719760	4726400	中国没希望 中国人没希望了 就是我也没希望了 我回去干啥
4728400	4736240	因为你必然 他未来必然退出改革开放 必然实现他的伟大梦想 完成供销事 收回台湾
4737520	4744000	与西方化疆而治 与川普达成内部交易 与整个西方为敌变成西朝鲜
4744640	4754480	那我回去干啥 我回去 如果我要是没达到基督徒 大爱的江戒 那我挺高兴的 为什么 我回去中国人都是牛马
4756640	4761520	中国人倒退到了1950年到1958年的那个状态 就是傻逼加牛马
4762480	4769520	1950年到1958年中国人不反共的 不反对毛主席 到现在还不反对的 这是傻逼嘛 洗脑
4770320	4776720	AI洗脑 劳A洗脑之后的 劳A这个这词儿夺他们恐怖 在劳里边炒A股
4777760	4786320	这他们是咒语 都变成劳A了 那样是中国人了 那我 我这个作为海外华侨 我是海外华裔
4787120	4793920	我他们的其实利益是最大化的 如果我没有不爱的心的话 我们是利益最大化的 因为我们这些海外华人
4794880	4799680	20 30年以后回国 那不就是他们的人上人啊 那就是当年的外宾呢
4801200	4808880	当年一个小小的香港发地产开放上 那时候李嘉诚还不是首富呢 那时候就一个李嘉诚回北京长安街投个五星级酒店
4809600	4811200	可以跟邓小平对谈
4812640	4813840	白拿长安街的地
4815200	4816000	就是李嘉诚
4818400	4822240	我们就我们再回去30年以后20年以后 我回就是他们李嘉诚
4823120	4824720	因为他们都是牛马吧
4826000	4831680	但是你这样做 你良心何在呀 禽兽上且物伤其类 何况人呢
4832960	4839760	所以呢 就是啊 竭尽所能的呼吁政变 希望引起他们解放军内部的这种警觉啊
4842080	4842640	心里知道
4844560	4845760	这么一干没有回头路
