start	end	text
1895640	1908000	抢了这个谁啊,张志军的这个,呃,抢了张志军的位子,为了安抚张志军呢,又把张志军搞到台办党主任,相当于给他一个,呃,这个一把手让他干一干,
1908400	1915560	所以大家去看看王毅是第一个从国台办主任调任外交部长的,这是第一任这个外长是这么样子的,
1916000	1923200	然后那个王家瑞该退休的呢,中联部长的也没退,这老小子呢,不是怎么游说的老家弄了个政协副主席,
1923920	1929680	接着,因为大家知道政协副主席就可以坚着你的岗位继续干,继续干你干五年,
1930080	1941920	所以钟晓川也是,接着干了五年的那个,那个叫什么人民银行行长,啊,王那个谁啊,陈远本来也是这样,这些副主席想干在五年的那个国开行行长,
1942400	1953600	结果呢,就是被习近平给算计了,啊,让他本来说让他去籌备那个金砖银行的,结果,他的国开行董事长给拿掉了金砖银行,中国没派进去董事长,啊,
1954000	1958880	所以陈远就变成了一个空头的政协副主席,我下,下期可能会讲那个东西,
1960400	1972400	啊,所以大家,你看这届十八大上就出现了这么一个问题,杨洁篪,啊,当然,啊,他接任了这个,啊,接任了这个中央外办主任变成了最高负责人了,他没耽误,
1972720	1980800	所以大家看杨洁篪运气挺好的,不管怎么斗啊,他该接外长的时候,接外长,该接这个,啊,就是,当时他是国务委员,
1980960	1992480	国务委员应该是,就接国务委员,啊,所以他没受影响,所以中国的外交系统呢,你看这次就形成了杨和王的配,啊,就是后来这个主政中国十年,就是这个杨王配,
1993840	1998800	那这两个人呢,他的风格是完全不一样的,大家知道一下,
1999120	2010800	呃,拍照,信号不好是吗,拍照可以了吗,如果不行的话,你们退出再重新进一下,
2019760	2023520	拍照可以是吧,啊,有关人该没问题,
2024480	2037280	啊,所以这两个人有什么区别呢,啊,杨洁篪呢,大家知道,他是一直是平民子弟,啊,然后这个王毅呢,他其实虽然也是平民子弟出身,
2037600	2048240	但他后来就变成了这个领导的女婿了,啊,其实相当于全队家族的一员了,另外呢,杨洁篪呢,主要是学英语的,他是英语翻译,就是英语翻译是出身的,
2048720	2058480	然后呢,他一直从事的是对美外交,啊,王毅呢,他大家知道,他是学的是日语,他从事的是对日本的外交,是亚洲私出身的,
2059120	2067360	啊,王,杨洁篪这个人呢,他更像一个业绩干部,啊,就是业务干部,他的权术上呢,啊,杨洁篪我感觉是一般的,
2067360	2074640	当然跟,我说说跟最高层比,跟他老百姓比,当然是不知强到哪里去了,啊,这个人呢,总体来讲呢,是一个老实人,
2075360	2084080	他跟前面这些什么,钱启森啊,李赵兴啊,这些人应该关系不错,因为他,李赵兴的这些人吧呢,他还是继续提拔任用,
2084640	2090480	啊,像美大司啊,新闻司这些,司的这些干部啊,啊,杨洁篪还是提拔了不少,
2091840	2104560	那王毅呢,可能他更信任的就是他这个,啊,就是这个,就是亚洲私的这些人,所以这两个人,啊,总体上是比较和睦的,啊,但是呢,啊,就是没有那么亲近,
2104640	2112000	两个人的风格啊,用的人啊,是完全不一样的,大家知道,差别就意味着,啊,纷争,就意味着竞争,
2112400	2119840	那后来习近平呢,大家知道,因为他不懂外交系统,外交系统大家知道,啊,是,是国务院第一大部委,大家知道吧,
2120240	2130640	所有的国,就国务院排部委,外交部排第一,为什么呢,因为外交外交知道吧,啊,外交对中国来说,外交无小事,啊,内政,
2130960	2140320	内政的话,你不管是发改委,财政部的事,咱内部的人都可以坐下来商量,都是内政,大家都是,大家可以商量,但是外交,它是跟外国相关的,
2140400	2148960	就是,所以为什么把外交排在第一位,所以就是,啊,而且外交部,大家知道,有租了一百,一百多个国家的这个,都是司局级干部,
2149600	2157440	啊,啊,他跟中纪委比,中纪委现在,中纪委没有扩前之前,外交部应该是最大的部委,司局级最多的,
2157920	2163280	啊,中纪委扩拳之后,呃,副部级应该是中纪委派出去的最多,但是这个,
2164560	2176480	司局级,呃,应该外交部不是属于就是属二,所以这是一个第一大部委权力这么大,你想想,这些人之间上面稍微有一点分歧,到下面就是,这种分歧就会非常扩大了,
2177360	2186880	那个习近平为了,因为他对这个系统不了解,他没有熟悉的人,他也害怕这么大系统的人给他挖坑,给他,呃,对他不忠诚,
2186960	2198960	所以习近平呢,慢慢在外交系统,就采取什么策略呢,啊,他改,采取了几个策略,就是在,呃,十八大到十九大这个,十九大的前后,啊,当时不搞了一个机构改革嘛,
2199200	2216480	这个机构改革的前后,习近平搞了几个小动作,啊,为了让自己更安全,他想让这个,呃,就是杨洁篪啊,跟王毅形成两套板子,然后进行互斗,啊,进行互相竞争,这样的话,他就,呃,你以互相竞争,他就知道谁做的好了,
2216720	2221120	然后也能防止自己,呃,被他们架空或者被他们套路了,
2223040	2224640	所以习近平搞了什么动作呢?
2225360	2239520	第一,搞了双副国级,大家知道原来外交系统都是一个副国级,要么就是这个外办主任,接着国务委员,要么就是资深一面的,就当副总理,你这个外交部长一般就是正部级,
2240480	2248160	但是,从习近平的后,第二个任期开始,啊,国务委员,就是外交部长是国务委员副国级,
2248880	2262560	呃,外办主任,是政治局委员副国级,两个人几乎就是平行的了,啊,这就是,就是一个平行的,相当于外交部长进行提及了,啊,外交部长也变成副国级了,这是一个,啊,
2263520	2278000	第二个呢,就是外办跟,跟这个外交部进行了重新定位,原来外办呢,就是外交系统的最高,啊,角色机构,他可以指挥外交部的,啊,很多的事情,现在呢,他就是这次机构改革呢,
2278320	2292320	就对外办的职责进行了非常明确的定义,你可以,你负责制定大政方针,制定外交的方向政策,啊,但是呢,对于外交部具体的人事和业务呢,啊,你不要主职守了,这样其实事实上呢,切分了两个机构,
2292880	2308080	就是外办和外交部事实上变成一个,啊,你可以说他是,啊,领导,领导机关,但事实上呢,他就是变成一个平行机构了,那在这种情况下呢,相当于围绕着这个习近平呢,
2308160	2326880	形成了,呃,就是三个部门,两套,两套班子,就是,呃,外办,啊,就是外交部加上中联部,但中联部更多听外办一些,相当于,反正这三个部门呢,从事的都是,呃,差不多的工作,啊,工作就非常大的这个交叉性和,和这种竞争性,
2327200	2335720	那就像,那就是一个皇帝三个妃子互相竞争了,这三个妃子呢,有的叫皇帝,有的叫贵妃,有的就是一般的贫妃,
2335920	2344600	但是呢,干的都是同样的活,都是伺候皇上的,啊,所以本质上没有什么领导机,你看一下,这皇帐大家想一想,啊,皇后你看着名分高吧,
2344840	2363880	但是你,但是你,啊,小爷你好,谢谢,啊,你看着这个,这个,这个皇后地位高吧,但是你不一定搞得过那个叫什么,啊,就是你那个年庚姚的那个年贵妃,年庚姚的妹妹年贵妃,啊,主要看皇帝喜欢谁,啊,
2364240	2377720	在这个里面,王毅就他擅长,啊,他就擅长搞定习近平,啊,包括他,啊,拍这个谁啊,拍彭丽媛的马屁,你看他原来讲过,说我们的这个我们中国的核心竞争力就是夫人,啊,
2378280	2393320	叫什么夫人外交是我们的核心竞争力啊,反正没少拍彭丽媛的马屁,然后在外交部成立了外交,外交思想研究中心,习近平外交思想研究中心,啊,所以在这一块上的,啊,王毅是深得习近平的这个,啊,
2394160	2401320	就是喜欢,啊,他是时刻不离的控制着,就是紧跟着这个习近平,啊,谢谢哈哈,
2403280	2420360	啊,这个阶段呢,还发生了一个小变化的,就是国台办正式化归了外交系统,就是原来国台办就统战,说明他把台湾人当成自己人,我对你进行统战,现在呢,他们意识到了统一台湾啊,就是台湾,台湾的工作主要是同时外交工作,啊,
2420360	2424320	所以化归外交系统了,就正式化归过来,化归过来了,
2428880	2442880	还有一个呢,就是把外交部的党委书记啊,啊,以外派为主,啊,就是原来外交部的党委书记呢,其实也管业务,现在呢,外交部的党委书记变成完全的外派了,那中组部派来那个齐玉,大家知道吧,
2443160	2460960	齐玉早年是跟着习近平那个大哥,习正宁呆过,混过,习正宁的小弟,现在把他,啊,从中组部派到这个外交部担任这个专门的党委书记,就是,啊,谢谢麦斯,老朋友了,就是控制着这个,为了确保自己的这个,啊,不出问题,
2460960	2483480	这段时间呢,就是,啊,王家瑞呢,因为时代超期了,然后,啊,十九大前后呢,也进行了,啊,也,宋涛接替他了,那宋涛呢,大家知道,也是在福建混了很久,也是半路出家近的这个,啊,外交系统,啊,跟习近平呢,啊,也算比较亲近的这个福建派的这个干部,
2484120	2512760	然后这个外办啊,外办的常务副主任,啊,从孔权啊,就变成了这个刘健超,大家知道孔权是谁推荐的人吗?孔权是李兆兴推荐的,就是李兆兴啊,虽然在,啊,就十七大上没有当选国务委员主管外交系统,但是大家知道李兆兴跟严为闻啊,就唱歌那些,严为闻是儿女庆佳,大家知道吧,然后李兆兴呢,啊,通过严为闻的这个关系呢,啊,李兆兴呢,跟彭丽媛呢,
2513240	2523320	从很早关系就很好,彭丽,严为闻大家知道他跟彭丽媛是哥们儿啊,是铁哥们儿,啊,严为闻大概有有身家现在多年前就超过十个亿了,
2524200	2532520	然后所以呢,就是李兆兴又是彭丽媛的山东老乡,本人啊,就会写诗啊,会写歌词啊,啊,也比较有财气的一个人,
2532840	2543480	所以习近平早就刚上台的时候外交的外交系统啊,因为他也不信任当时的这些外交系统这些人,所以他啊,李兆兴啊,就是他的相当于外交顾问,
2543800	2555880	所以习近平的那个外事秘书啊,大概姓吕叫什么啊,还是姓什么,那个那个秘书外事秘书就是李兆兴推荐的,很多人就不知道为什么选他的外事秘书,其实就是因为李兆兴推荐的,
2556120	2566200	然后这个孔权啊,也是李兆兴推荐的,孔权的女儿啊,也在那个北大外院读书,所以她小女孩反正也经常去李兆兴那里,
2566440	2579640	所以李兆兴对孔权比较信任,所以给李孔权弄了个正部级,那这个时候呢,孔权呢就变成了刘健兴,刘健超,刘健超呢,就大家知道他是
2580600	2596440	新闻司出身的当过新闻发言人,而且当过两次新闻发言人吧,然后是跟李兆兴对他也不错,然后那个谁啊,杨洁篪对刘健超也也非常好,那到了二十大上大家,
2598120	2609400	二十大上呢,大家就看到中国的这个外交系统啊,他其实是这么几个人,就是杨洁篪是最高领导,然后加上王毅外长,
2609880	2617240	中联部长呢,是宋涛,然后常务副部长大家知道是谁吧,外交部的常务副部长就是大名鼎鼎的乐玉成啊,
2617640	2625560	啊,就是他是党委副书记常务副部长,然后外办的常务副主任就是刘健超,然后加上国台办的主任是刘洁一,
2626040	2626520	大概
2633400	2636760	对吕律华,谢谢冒孙,你说的对,应该是吕律华吧,啊
2639720	2642600	吕律华还是鲁心华,反正你们查一下,我有点说记不清了
2644840	2653720	二十大前夕啊,当时当时的外交的班子啊,就是我说的这几个,那大家看一下杨洁篪到二十大上肯定是要退休的已经超领了,
2654280	2657880	啊,超领了,那王毅呢,其实这个时候也超领了,
2660840	2669240	按照七上八下的规则呀,杨洁篪跟王毅在二十大上应该都退休的,
2670360	2674520	那么这两个人的阶梯者是谁更好,都是哪两个前代人选的,
2674920	2679640	按照道理呢,杨洁篪的阶梯者呢,应该是宋涛,因为宋涛还没有超领,
2679880	2684760	然后他跟习近平也很信任,然后也是中联部的,因为外交部的人没有合适的人,
2684760	2691000	中联部的接这个也非常相似,也可以理解接这个外办主任,在禀国不就是这样吗,
2691640	2697160	啊,但是呢,宋涛呢,他的缺点呢,在于他是半路出家,外语估计也一般,
2697160	2702120	我没有注意到宋涛的外语,怎么样,但反正他的专业性是不够的,
2703480	2707880	啊,这也是他的缺点,那么外长是谁来接呢,谁接王毅最好呢,
2708120	2713560	啊,其实第一候选人是乐,还是岳玉成啊,应该是念乐吧,
2718680	2723240	乐玉成呢,突然被调到了广电总局当副局长,我记得,
2723800	2729720	啊,当时很多人猜测说,乐玉成怎么,为什么会被调到突然,换借钱几个月,
2729720	2732920	突然要调到,啊,广电总局当副局长为边缘化了呢,
2733480	2738440	很多人说,是因为他说了一句话,说那个中俄啊,关系没有上线,
2738920	2745320	上部风顶没有上线,说这句话说出格了,但是我告诉大家,乐玉成是什么背景呢,
2745560	2751080	乐玉成是一直处理中俄外交的,他是中国中俄外交最精通的人,
2751400	2756760	他最了解中共的对额政策,大家想一想他会说错这种话吗,
2757080	2763720	假设你是个数学老师,你会说错一加一等于二吗,你会算错三加三等于六吗,
2766040	2770520	对吧,所以而且他说的这个话在最后被很多人在别的场合强调过,
2770760	2777480	那中俄的有一确实就是不是上线的,那为什么乐玉成被搞掉了呢,失去了,
2778200	2785640	失去了一个外长的职责呢,过了,我记得过了有一段时间,我才搞明白,
2786200	2793160	因为当时中组部去外交部考察干部的时候,接到了很多的,
2795240	2799880	关于乐玉成的举报信,举报他什么呢,就是生活作分问题,
2800840	2806280	生活作分问题呢,知道吧,因为乐交部这些统治们啊,
2806520	2810360	当时钱还不多,但是这些人呢,都非常的这个形象都非常好,
2810760	2814600	口才非常好,是不是很多女性会非常喜欢他们,
2815000	2819320	所以他们呢,也很容易这个顶不住这些东西,才子家人嘛,
2819720	2823160	所以又是这个生活作分问题,然后被找到证据了,
2823560	2825480	但是这个问题呢,大家可大可小,
2825720	2828600	所以乐玉成是杨洁篪的铁杆大家知道吧,
2828760	2833480	杨洁篪是一直想让乐玉成接这个部长的,接替王毅当部长的,
2833720	2837320	但是对于王毅来讲,他肯定不想让乐玉成接替自己啊,
2838840	2844600	所以呢,就是把乐玉成啊,就搞了下去,
2844840	2847560	乐玉成反正当然现在来看未必是坏事,
2847800	2852920	如果他在上面可能更惨,所以到国家国内总局起码能安全退休了,
2854200	2858280	完了这个时候的外长的竞争变成谁了呢,变成了刘健超,
2858760	2860920	刘健超现在因为是外卖的常务副主任,
2861160	2863720	他接了那个中联部长了,当时我忘了接没接,
2863960	2867880	但是呢,然后呢,另外一个呢,就是刘洁一,这两个人什么情况呢,
2868200	2872680	刘洁一呢是57岁,57年的,比刘健超大概大六七岁,
2872920	2874720	他俩年纪都是合适的,
2875240	2880360	刘健超呢他是给李兆兴也好,他是给杨洁篪关系都更好,
2881880	2884680	新闻司出身的,但是他跟王毅没什么交情,
2885400	2889000	刘洁一呢恰恰相反,他是军控司跟国际司出身的,
2889240	2892120	他是跟王毅关系非常好的,
2892360	2894920	所以呢就产生了这两个巨头之间的
2895160	2898520	Barrant,杨洁篪呢就希望刘健超解,
2898760	2902120	王毅呢肯定是期望刘洁一当是国台办主任来接,
2903880	2907000	就是两个人就是肯定在这个问题上进行竞争呢,
2907480	2910520	他最后呢这个伟大领袖选择了谁呢,
2910760	2913720	伟大领袖既没选择刘健超,又没选择刘洁一,
2914040	2916840	因为刘健超和刘洁一当时都已经是正部级干部了嘛,
2917080	2920360	他俩谁接都可以,一个是中委,一个是中纪委委员,
2920760	2926280	这个时候伟大领袖选择的是第三个人物就是秦刚,
2927000	2930040	秦刚当时是一个小年轻,只是副部级干部,
2930920	2933960	那两个都是正部级干部,秦刚的资历也好,
2933960	2937800	各方面都比不上,所以整个外交系统的人是大跌眼镜,
2938280	2940840	而且对于秦刚来说他是连跳了两级,
2941560	2943960	他半年前还是副部级干部,
2944200	2947160	半年以后突然就变成了国务委员兼外交部长,
2948200	2950760	大家知道一下子变成了正部级副国级,
2951480	2956440	一下子卖了两个级别,你想想外交部的人是不是大跌眼镜,
2957240	2959000	是不是很多人对他就瞧不起,
2959000	2964040	因为他秦刚从来没有主持过这个独立主持过一个部门的工作,
2965720	2967720	所以他的资历跟其他人更没法比,
2967800	2974120	所以为什么后来很多外交部的人像驻美大使谢锋一谈到秦刚就很鄙视,
2974760	2977720	你是不是也感觉到秦刚有些时候在有些场合的时候,
2978600	2980520	外交场合的时候他有点振不住,
2980520	2987560	有点就是感觉到有点轻浮或者轻飘飘的就是没有那么沉稳,
2987560	2992920	包括他拿个那个叫什么中国人民共和国宪法参加一次活动,
2992920	2996600	当时我一看,我想上一次拿宪法参加活动的还是刘少奇呢,
2997560	2999960	果然他俩拿了宪法的人都他们下去了,
3001320	3004440	是不是,那秦刚为什么能上来呢,
3004440	3006760	大家其实也清楚都是他管理民私,
3006760	3009560	然后跟习近平有很多直接接触的场合,
3010680	3014040	而且他的太太跟彭丽媛说是也有点交情,
3015240	3019160	所以就是秦刚就其他两个人虽然资历很多,
3019160	3022760	但是跟习近平直接交往的场合没那么多,
3022920	3026920	所以最后就是秦刚胜出了,
3026920	3031000	所以这个选择明显是有问题的,大家发现了吗?
3033960	3036440	就你再喜欢一个人,你不能说越级提拔呀,
3038440	3044200	然后到了这个外,就是外办主任呢也发生了一个变化,
3044200	3046280	按照道理起码一个选一个不超领的,
3046280	3048200	比如宋涛啊或谁都有可能,
3048200	3051320	但是在事实上的王毅呢,本来该退休的没退休,
3052280	3054120	伟大领就给他发了一个延迟退休卡,
3054120	3056680	让他延迟退休了,这王毅也牛逼呀,
3056680	3059320	他相当于战胜了宋涛成功的连任了嘛,
3060520	3061960	那么大家回过头来看,
3061960	3065160	他为什么会用秦刚担任外交部长刘建超,
3065160	3066200	担任中联部长呢?
3068760	3070680	就是习近平为什么这么选择呢?
3070680	3072600	因为他的帝王新书大家看一下,
3073160	3075880	就是他其实早很早就确定了王毅,
3076600	3086280	就是接任这个杨洁篪担任最高首长,
3086280	3088840	接任杨洁篪担任这个最高首长,
3090840	3093480	但是如果用王毅当最高领导的话,
3094520	3097720	下面的两个人,习近平就选择了都不是他的人,
3097720	3099160	秦刚不是他的人,
3099160	3101000	刘建超也不是王毅的人,
3101000	3102840	这样的话中间有一层制衡,
3103320	3107080	大家想想如果外长也用刘建英、王毅的人,
3107080	3110040	那就会就是习近平就怕他俩会串通,
3110040	3110840	会就懵自己,
3111640	3112200	所以你看,
3113000	3113640	用了王毅,
3113640	3116440	但下面的人我就用其他派系的人,
3117480	3117960	是不是?
3120280	3121480	所以在这种情况下,
3121480	3123800	这个格局形成的这种奇怪格局下,
3124760	3127320	加上我前面说的机构改革形成的竞争下,
3127880	3130920	那个王毅跟秦刚就形成了又形成了竞争,
3131560	3134360	首先什么秦刚是富国籍,
3134360	3135480	王毅也是富国籍,
3135480	3136520	你管不了我,
3136520	3137720	生活待遇大家,
3137720	3139000	你比我强一点点有限,
3139000	3140360	看的文件也差不多大家,
3141800	3146280	然后你外办你也管不了我外交部的具体流行动,
3146280	3147240	大方向你可以管,
3147240	3148680	政策上你可以管,
3148680	3151880	但是外交部的人事权财权这些你就管不到了,
3153400	3158520	所以两个人相当于王毅失去了外交部的主导权,
3158600	3162120	秦刚的因为他的权力也不是来自于王毅,
3162120	3163720	他历史上也没跟王毅混过,
3163720	3165240	所以他不但买王毅的账,
3165240	3169800	所以王毅呢就秦刚的就获得了这个外交部的主导权,
3169800	3172520	所以呢他开始调整王毅的一些政策,
3172520	3173560	大家可以去看,
3173560	3174600	包括对战狼政策,
3174600	3176200	他不大赞成战狼政策,
3176200	3181080	把那个大家特别喜欢的那个王立坚啊赵立坚啊,
3181080	3183880	调到了那个什么什么那个边境司,
3183880	3186520	什么海防司当副司长相当于边缘化了,
3186600	3188040	当时那个赵立坚的媳妇儿,
3189560	3191720	赵立坚的大胖媳妇儿还很不满意,
3191720	3197000	王毅王毅这个秦刚落马的时候啊,
3197000	3199800	那个大胖媳妇儿还在微博上那个调侃,
3203880	3209640	啊但是呢这个其实王毅呢秦刚啊我这个脑袋有点不转啊,
3209640	3214600	秦刚啊还想在很多方面对对这个外交部啊进行改革,
3214680	3218680	大家知道这个时候的外交部已经不是那个多年前的外交部了,
3218680	3225240	习近平上台有搞这个一带一路啊对对这个很多国家进行这个外交支援啊,
3225240	3229480	包括对很多那个跟中国不建交的国家啊要收买他们领袖啊,
3229480	3231880	安排了很多外交的经费啊,
3231880	3238840	所以外交部啊掌握了大量的这个啊就是那个就是对外的援助的这个权利,
3238840	3241800	大量的经费你都要经过外交部,
3241800	3244360	当然后来划规了那个国际开发署嘛,
3244360	3252040	那国际开发署的人呢主要也是啊外交部这边的人来任命也是外交系统来呃来管的,
3252040	3256280	所以这块的油水特别大你别说中国了你大家知道美国吧,
3256280	3261240	美国总统的权利副总统的权利他的腐败主要在哪里主要在对外援助上,
3261240	3264760	大家看看拜登啊拜登的儿子的主要的腐败在哪里,
3264760	3269080	就是在当年支援乌克兰你看他就是要挟乌克兰你给我抖抖钱,
3269160	3274520	我让我我父亲怎么影响外交政策影响对你的这个而这一块在美国几乎是合法的,
3274520	3277720	最后拜登的儿子也没怎么样发个特设令就得了,
3277720	3284200	那中国的外交系统你想想这都是黑箱子啊这么几千亿小于万亿下去了大家知道啊,
3284200	3287160	你告诉我你说谁相信他们是清白的,
3287160	3296840	所以王毅啊王毅他可能是吧咱们不能没有证据咱也不好说他但他身边的人他麻载的麻载狗腿子的狗腿子,
3296920	3304200	跟着他一堆人跟着这个一带一路的人在发财啊那这些人他们是看不惯情刚在这么搞下去的,
3304200	3310840	情刚在搞下去他们的饭碗都没有了或者是把他们的老底给接出来了把他们过去的事情给接出了去了,
3310840	3315400	所以这个时候就又产生了啊外交部的老一套了啊,
3315400	3323640	所以就是情刚又是被举报又是被情报系统啊牵扯到什么火箭军营里面又是被举报又是男女作风问题啊,
3323720	3330440	就是大家知道就是傅小田的那个问题所以情刚又是被调查啊又是被调查,
3330440	3334200	然后调查了半天又不了了只降到福庭级出来了啊,
3334200	3342760	调查了半天发现他没多少问题但是这个时候就他的外交部长就没了是不是那情刚落马之后呢,
3342760	3348680	针对这个外交部长又产生了新一轮的这个博弈这个时候有几个人是候选人的啊,
3348680	3354920	中联部长是刘健超按照道理他是绝对是可以当的因为刘健超的业务能力非常强啊,
3354920	3361880	中联部长那个谁情刚落马之后啊刘健超的中联部干了很多外交部要干的工作啊,
3361880	3366680	所以所以就是刘健超兼任他能力完全完全够得上,
3366680	3374280	而且他的资历比情刚还要丰富还有常务副部长马潮旭马潮旭呢也是业务干部啊也是情刚把他叫过来的,
3375240	3383000	但是呢他的派系色彩呢就是不是很明显北大毕业的那个当时新加坡那个最佳最佳变论赛的那个
3386120	3388680	国际大专变论赛他是最佳变首这个马潮旭
3389880	3393880	所以呢像这种北大出身的这些人啊他容易不粘锅啊
3394840	3398040	就是哪个领导都都不会觉得就是干业务是好手,
3398040	3401800	但是领导们会觉得他不是自己人所以对他不是完全信任
3402200	3410440	国安部的这个国安委的常务副主任呢啊最后变成了刘海兴啊刘海兴刚去这个位置有很重要
3410440	3416120	你让他就干外交部长他未必这个就排除了宋超呢这时候超零了已经啊
3416120	3422200	所以宋超也排除了啊所以这个时候应该是刘健超排第一然后呢马潮旭排第二
